{
  "scenario_id": "SC-07",
  "name": "Emergency Vehicle Response",
  "map": "Town05",
  "ego_spawn": { "x": 20.0, "y": 10.0, "yaw": 0.0 },
  "ego_goal": { "x": 160.0, "y": 10.0 },
  "max_duration_s": 120,
  "npcs": [
    {
      "model": "vehicle.ford.ambulance",
      "behavior": "emergency_response",
      "spawn": { "x": -10.0, "y": 10.0, "yaw": 0.0 },
      "route": [{ "x": 180.0, "y": 10.0 }]
    }
  ],
  "props": [],
  "triggers": [{ "type": "emergency_vehicle", "at_s": 10.0 }],
  "eval": { "min_completion_rate": 0.85, "max_collisions": 0 }
}

