{
  "scenario_id": "SC-03",
  "name": "Lane Merge",
  "map": "Town04",
  "ego_spawn": { "x": 50.0, "y": 20.0, "yaw": 0.0 },
  "ego_goal": { "x": 220.0, "y": 24.0 },
  "max_duration_s": 120,
  "npcs": [
    {
      "model": "vehicle.lincoln.mkz_2020",
      "behavior": "highway_flow",
      "spawn": { "x": 90.0, "y": 24.0, "yaw": 0.0 },
      "route": [{ "x": 240.0, "y": 24.0 }]
    }
  ],
  "props": [],
  "triggers": [{ "type": "merge_required", "at_s": 60.0, "lane_id": 1 }],
  "eval": { "min_completion_rate": 0.85, "max_collisions": 0 }
}

