{
  "scenario_id": "SC-02",
  "name": "Urban Intersection",
  "map": "Town10HD",
  "ego_spawn": { "x": 15.0, "y": -20.0, "yaw": 90.0 },
  "ego_goal": { "x": 15.0, "y": 80.0 },
  "max_duration_s": 120,
  "npcs": [],
  "props": [],
  "triggers": [{ "type": "intersection_conflict", "at_s": 30.0 }],
  "eval": { "min_completion_rate": 0.85, "max_collisions": 0 }
}
