{
  "scenario_id": "SC-TEST",
  "name": "Fixture Scenario",
  "map": "Town04",
  "ego_spawn": { "x": 0.0, "y": 0.0, "yaw": 0.0 },
  "ego_goal": { "x": 10.0, "y": 0.0 },
  "max_duration_s": 10,
  "npcs": [],
  "props": [],
  "triggers": [],
  "eval": { "min_completion_rate": 0.5, "max_collisions": 0 }
}

